{
  "$schema": "http://json-schema.org/draft-07/schema#",
  "title": "PersistentActivationMessageEnvelope",
  "type": "object",
  "additionalProperties": false,
  "required": ["type", "contractVersion", "correlationId", "tabId", "youtubeVideoId", "occurredAtUtc", "payload"],
  "properties": {
    "type": { "type": "string", "enum": ["PLAYER_PLAYING", "PLAYER_PAUSED", "PLAYER_BUFFERING", "PLAYER_SEEKED", "PLAYER_ENDED", "ACTIVATION_ENABLED", "ACTIVATION_DISABLED", "VIDEO_CONTEXT_CHANGED", "VIDEO_CONTEXT_UNAVAILABLE", "OPERATION_STATUS_CHANGED", "SEEK_REQUEST", "SEEK_COMPLETED", "SEEK_REJECTED"] },
    "contractVersion": { "const": "0.7.0" },
    "correlationId": { "type": "string", "minLength": 1 },
    "tabId": { "type": "integer", "minimum": 0 },
    "youtubeVideoId": { "type": "string", "pattern": "^[A-Za-z0-9_-]{11}$" },
    "occurredAtUtc": { "type": "string", "format": "date-time" },
    "payload": { "type": "object" }
  },
  "allOf": [
    { "if": { "properties": { "type": { "const": "ACTIVATION_ENABLED" } }, "required": ["type"] }, "then": { "properties": { "payload": { "$ref": "#/$defs/activationEnabledPayload" } } } },
    { "if": { "properties": { "type": { "const": "ACTIVATION_DISABLED" } }, "required": ["type"] }, "then": { "properties": { "payload": { "$ref": "#/$defs/activationDisabledPayload" } } } },
    { "if": { "properties": { "type": { "const": "VIDEO_CONTEXT_CHANGED" } }, "required": ["type"] }, "then": { "properties": { "payload": { "$ref": "#/$defs/videoContextChangedPayload" } } } },
    { "if": { "properties": { "type": { "const": "VIDEO_CONTEXT_UNAVAILABLE" } }, "required": ["type"] }, "then": { "properties": { "payload": { "$ref": "#/$defs/videoContextUnavailablePayload" } } } },
    { "if": { "properties": { "type": { "const": "OPERATION_STATUS_CHANGED" } }, "required": ["type"] }, "then": { "properties": { "payload": { "$ref": "#/$defs/operationStatusPayload" } } } },
    { "if": { "properties": { "type": { "enum": ["PLAYER_PLAYING", "PLAYER_PAUSED", "PLAYER_ENDED"] } }, "required": ["type"] }, "then": { "properties": { "payload": { "$ref": "#/$defs/playerPayload" } } } },
    { "if": { "properties": { "type": { "const": "PLAYER_BUFFERING" } }, "required": ["type"] }, "then": { "properties": { "payload": { "$ref": "#/$defs/bufferingPayload" } } } },
    { "if": { "properties": { "type": { "const": "PLAYER_SEEKED" } }, "required": ["type"] }, "then": { "properties": { "payload": { "$ref": "#/$defs/seekedPayload" } } } }
  ],
  "$defs": {
    "preferenceSnapshot": { "type": "object", "additionalProperties": false, "required": ["questionType", "difficulty"], "properties": { "questionType": { "type": "string", "enum": ["multipleChoice", "shortAnswer"] }, "difficulty": { "type": "string", "enum": ["easy", "medium", "hard"] } } },
    "activationEnabledPayload": { "type": "object", "additionalProperties": false, "required": ["activationId", "source", "videoTitle", "preferences"], "properties": { "activationId": { "type": "string", "minLength": 1 }, "source": { "type": "string", "enum": ["user", "storageRestore"] }, "videoTitle": { "type": "string", "minLength": 1 }, "preferences": { "$ref": "#/$defs/preferenceSnapshot" } } },
    "activationDisabledPayload": { "type": "object", "additionalProperties": false, "required": ["reasonCode"], "properties": { "reasonCode": { "const": "userDisabled" } } },
    "videoContextChangedPayload": { "type": "object", "additionalProperties": false, "required": ["transitionId", "previousActivationId", "previousYoutubeVideoId", "videoTitle"], "properties": { "transitionId": { "type": "string", "minLength": 1 }, "previousActivationId": { "type": "string", "minLength": 1 }, "previousYoutubeVideoId": { "type": "string", "pattern": "^[A-Za-z0-9_-]{11}$" }, "videoTitle": { "type": "string", "minLength": 1 } } },
    "videoContextUnavailablePayload": { "type": "object", "additionalProperties": false, "required": ["transitionId", "previousActivationId", "previousYoutubeVideoId", "reasonCode"], "properties": { "transitionId": { "type": "string", "minLength": 1 }, "previousActivationId": { "type": "string", "minLength": 1 }, "previousYoutubeVideoId": { "type": "string", "pattern": "^[A-Za-z0-9_-]{11}$" }, "reasonCode": { "const": "unsupportedWatchPage" } } },
    "operationStatusPayload": { "type": "object", "additionalProperties": false, "required": ["operation", "state", "message", "retryable"], "properties": { "operation": { "type": "string", "enum": ["transcriptUpload", "transcriptGenerate", "sessionStart", "quizGenerate", "answerSubmit", "historyLoad"] }, "state": { "type": "string", "enum": ["pending", "succeeded", "failed"] }, "code": { "type": "string", "minLength": 1 }, "message": { "type": "string", "minLength": 1 }, "retryable": { "type": "boolean" }, "traceId": { "type": "string", "minLength": 1 } } },
    "nonNegativeMilliseconds": { "type": "integer", "minimum": 0 },
    "playerPayload": { "type": "object", "additionalProperties": false, "required": ["currentTimeMs"], "properties": { "currentTimeMs": { "$ref": "#/$defs/nonNegativeMilliseconds" }, "durationMs": { "$ref": "#/$defs/nonNegativeMilliseconds" } } },
    "bufferingPayload": { "type": "object", "additionalProperties": false, "required": ["currentTimeMs"], "properties": { "currentTimeMs": { "$ref": "#/$defs/nonNegativeMilliseconds" }, "durationMs": { "$ref": "#/$defs/nonNegativeMilliseconds" }, "bufferedUntilMs": { "$ref": "#/$defs/nonNegativeMilliseconds" } } },
    "seekedPayload": { "type": "object", "additionalProperties": false, "required": ["currentTimeMs"], "properties": { "currentTimeMs": { "$ref": "#/$defs/nonNegativeMilliseconds" }, "previousTimeMs": { "$ref": "#/$defs/nonNegativeMilliseconds" }, "durationMs": { "$ref": "#/$defs/nonNegativeMilliseconds" } } }
  }
}
