{
  "type": "ACTIVATION_ENABLED",
  "contractVersion": "0.7.0",
  "correlationId": "a3e78ce7-561a-4a51-bfdb-d46f8f0e7d8d",
  "tabId": 7,
  "youtubeVideoId": "dQw4w9WgXcQ",
  "occurredAtUtc": "2026-09-29T10:00:00.000Z",
  "payload": {
    "activationId": "f9e4f1e5-594f-4da7-a80a-670e07163d90",
    "source": "user",
    "videoTitle": "Networking lesson",
    "preferences": { "questionType": "multipleChoice", "difficulty": "medium" }
  }
}
